{
  "schemaVersion": "2",
  "capability": "epub.literary.structure.format",
  "status": "planned",
  "input": {
    "path": "\u003cfixture.epub\u003e"
  },
  "facts": {
    "epub.literary.structure.format.assignmentsTotal": 1,
    "epub.literary.structure.format.editCount": 2,
    "epub.literary.structure.format.plannedEdits": [
      {
        "path": "OEBPS/Text/01-body.xhtml",
        "target": "blockquote[0]",
        "action": "add-class",
        "value": "epigraph"
      },
      {
        "path": "OEBPS/Text/01-body.xhtml",
        "target": "head",
        "action": "add-link",
        "value": "../Styles/literary.css"
      }
    ],
    "epub.literary.structure.format.skipped": [],
    "epub.package.nav.audit.findingsByLevel": {
      "error": 0,
      "warn": 0,
      "info": 1
    },
    "epub.package.nav.audit.status": "complete",
    "pipeline.dryRun": true,
    "pipeline.modifiedEntries": [
      "OEBPS/Text/01-body.xhtml"
    ]
  },
  "findings": [],
  "events": [
    {
      "step": "drm-preflight",
      "status": "completed"
    },
    {
      "step": "epub.package.nav.audit",
      "status": "completed",
      "message": "diagnostic: 0 error, 0 warn"
    },
    {
      "step": "epub.literary.structure.format",
      "status": "completed"
    },
    {
      "step": "redline",
      "status": "completed",
      "message": "0 findings"
    }
  ],
  "nextCommands": [
    "epub run epub.literary.structure.format --input fixture.epub --output out.epub --json 'assignments=[{\"path\":\"OEBPS/Text/01-body.xhtml\",\"tag\":\"blockquote\",\"index\":0,\"class\":\"epigraph\"}]' stylesheet=OEBPS/Styles/literary.css"
  ]
}
