{
  "schemaVersion": "2",
  "capability": "epub.vertical.ruby.optimize",
  "status": "planned",
  "input": {
    "path": "\u003cfixture.epub\u003e"
  },
  "facts": {
    "epub.package.nav.audit.findingsByLevel": {
      "error": 0,
      "warn": 0,
      "info": 1
    },
    "epub.package.nav.audit.status": "complete",
    "epub.vertical.ruby.optimize.editCount": 2,
    "epub.vertical.ruby.optimize.filesScanned": 2,
    "epub.vertical.ruby.optimize.op": "ruby-rp",
    "epub.vertical.ruby.optimize.plannedEdits": [
      {
        "path": "OEBPS/chapter.xhtml",
        "action": "insert-rp",
        "target": 1
      }
    ],
    "epub.vertical.ruby.optimize.skipped": [],
    "pipeline.dryRun": true,
    "pipeline.modifiedEntries": [
      "OEBPS/chapter.xhtml"
    ]
  },
  "findings": [],
  "events": [
    {
      "step": "drm-preflight",
      "status": "completed"
    },
    {
      "step": "epub.package.nav.audit",
      "status": "completed",
      "message": "diagnostic: 0 error, 0 warn"
    },
    {
      "step": "epub.vertical.ruby.optimize",
      "status": "completed"
    },
    {
      "step": "redline",
      "status": "completed",
      "message": "0 findings"
    }
  ],
  "nextCommands": [
    "epub run epub.vertical.ruby.optimize --input fixture.epub --output fixture.vertical-ruby-optimize.epub --json op=ruby-rp"
  ]
}
