{
  "schemaVersion": "2",
  "capability": "epub.package.nav.audit",
  "status": "complete",
  "input": {
    "path": "templates/cleanup-demo-books/dist/legacy-epub2-before.epub",
    "sha256": "d7b72096296c3122bf9a8da0b75513140977a327493cb13e87ebc9279c378715"
  },
  "facts": {
    "epub.package.nav.audit.actionableFindings": [],
    "epub.package.nav.audit.auditStatus": "warn",
    "epub.package.nav.audit.findingsByLevel": {
      "error": 0,
      "warn": 3,
      "info": 0
    },
    "epub.package.nav.audit.input_kind": "existing-epub",
    "epub.package.nav.audit.recommendedSkills": [
      "$epub-audit",
      "$epub-cleanup",
      "$epub-reader-verify"
    ],
    "epub.package.nav.audit.summary": {
      "language": "zh-CN",
      "manifest_items": 6,
      "media_counts": {
        "css": 1,
        "fonts": 0,
        "images": 1,
        "other": 1,
        "xhtml": 3
      },
      "opf": "OEBPS/package.opf",
      "package_version": "2.0",
      "spine_items": 3,
      "zip_entries": 11
    },
    "epub.package.nav.audit.toolAvailability": {
      "epubcheck": true
    }
  },
  "findings": [
    {
      "level": "warn",
      "id": "audit.0",
      "title": "EPUB 2 package should be migrated to EPUB 3 before richer cleanup/features",
      "detail": "epub3-migration"
    },
    {
      "level": "warn",
      "id": "audit.1",
      "title": "EPUB 3 package should contain exactly one nav item"
    },
    {
      "level": "warn",
      "id": "audit.2",
      "title": "Cover should have properties=\"cover-image\" and legacy meta name=\"cover\""
    }
  ],
  "events": [
    {
      "step": "epub.package.nav.audit",
      "status": "completed"
    }
  ]
}
