{
  "schemaVersion": "2",
  "capability": "epub.typography.english.optimize",
  "status": "planned",
  "input": {
    "path": "\u003cfixture.epub\u003e"
  },
  "facts": {
    "epub.package.nav.audit.findingsByLevel": {
      "error": 0,
      "warn": 4,
      "info": 0
    },
    "epub.package.nav.audit.status": "complete",
    "epub.typography.english.optimize.editCount": 3,
    "epub.typography.english.optimize.filesScanned": 3,
    "epub.typography.english.optimize.plannedEdits": [
      {
        "path": "OEBPS/Text/english-1.xhtml",
        "action": "add-lang",
        "value": "en"
      },
      {
        "path": "OEBPS/Text/english-2.xhtml",
        "action": "add-lang",
        "value": "en"
      },
      {
        "path": "OEBPS/Text/english-3.xhtml",
        "action": "add-lang",
        "value": "en"
      }
    ],
    "epub.typography.english.optimize.skipped": [
      {
        "path": "OEBPS/Text/copyright.xhtml",
        "reason": "outside-scope"
      }
    ],
    "pipeline.dryRun": true,
    "pipeline.modifiedEntries": [
      "OEBPS/Text/english-1.xhtml",
      "OEBPS/Text/english-2.xhtml",
      "OEBPS/Text/english-3.xhtml"
    ]
  },
  "findings": [
    {
      "level": "info",
      "id": "upstream.diagnostics",
      "title": "epub.package.nav.audit reported 0 error / 4 warn findings (diagnostic, not blocking)",
      "detail": "see facts[\"epub.package.nav.audit.findingsByLevel\"]",
      "location": "epub.package.nav.audit"
    },
    {
      "level": "info",
      "id": "english.opf-language-differs",
      "title": "OPF language differs from the requested XHTML language",
      "detail": "dc:language=[\"zh-CN\"]; requested primary language=\"en\"",
      "location": "OEBPS/content.opf"
    }
  ],
  "events": [
    {
      "step": "drm-preflight",
      "status": "completed"
    },
    {
      "step": "epub.package.nav.audit",
      "status": "completed",
      "message": "diagnostic: 0 error, 4 warn"
    },
    {
      "step": "epub.typography.english.optimize",
      "status": "completed"
    },
    {
      "step": "redline",
      "status": "completed",
      "message": "0 findings"
    }
  ],
  "nextCommands": [
    "epub run epub.typography.english.optimize --input fixture.epub --output out.epub --json 'scope_paths=[\"OEBPS/Text/english-1.xhtml\",\"OEBPS/Text/english-2.xhtml\",\"OEBPS/Text/english-3.xhtml\"]'"
  ]
}
