{
  "schemaVersion": "2",
  "capability": "epub.vertical.ruby.optimize",
  "status": "complete",
  "input": {
    "path": "\u003cfixture.epub\u003e"
  },
  "facts": {
    "epub.package.nav.audit.findingsByLevel": {
      "error": 0,
      "warn": 0,
      "info": 1
    },
    "epub.package.nav.audit.status": "complete",
    "epub.vertical.ruby.optimize.editCount": 1,
    "epub.vertical.ruby.optimize.filesScanned": 1,
    "epub.vertical.ruby.optimize.op": "writing-mode-prefix",
    "epub.vertical.ruby.optimize.plannedEdits": [
      {
        "path": "OEBPS/vertical.css",
        "action": "insert-prefix",
        "target": ".body"
      }
    ],
    "epub.vertical.ruby.optimize.skipped": []
  },
  "findings": [],
  "events": [
    {
      "step": "drm-preflight",
      "status": "completed"
    },
    {
      "step": "epub.package.nav.audit",
      "status": "completed",
      "message": "diagnostic: 0 error, 0 warn"
    },
    {
      "step": "epub.vertical.ruby.optimize",
      "status": "completed"
    },
    {
      "step": "redline",
      "status": "completed",
      "message": "0 findings"
    },
    {
      "step": "write-output",
      "status": "completed",
      "message": "captured in memory; no disk write"
    }
  ]
}
