{
  "schemaVersion": "2",
  "capability": "epub.font.subset",
  "status": "complete",
  "input": {
    "path": "\u003cfixture.epub\u003e"
  },
  "output": {
    "path": "\u003ccandidate.epub\u003e"
  },
  "facts": {
    "epub.font.subset.changedFonts": [
      "OEBPS/Fonts/full.ttf"
    ],
    "epub.font.subset.fontEntries": [
      "OEBPS/Fonts/full.ttf",
      "OEBPS/Fonts/math.otf"
    ],
    "epub.font.subset.provider": "epub-font",
    "epub.font.subset.providerLog": "provider did not return diagnostic output",
    "epub.font.subset.providerReport": {
      "schemaVersion": 1,
      "providerVersion": "test-1.0",
      "fontToolsVersion": "4.test",
      "inputSHA256": "acb9b749d23c0bc739d2f28009c4754ae555079733dee91f7136a62a1120e1e5",
      "outputSHA256": "c84fc10479b1b321c721fda304236fa797ddce2226c1413cc33bd062e5810cf6",
      "ok": true,
      "fonts": [
        {
          "target": "OEBPS/Fonts/full.ttf",
          "action": "subset",
          "reason": "",
          "masterSHA256": "acff6485c11e6d62264aecdf123bf905cee5c01711d4652d01c31ecea9cce739",
          "originalSHA256": "acff6485c11e6d62264aecdf123bf905cee5c01711d4652d01c31ecea9cce739",
          "outputSHA256": "f53ecea585f90e2836aeeadfe3e488c3e50926af7d0c5929a72e3dae7507a135",
          "masterBytes": 9,
          "originalBytes": 9,
          "outputBytes": 11,
          "masterGlyphs": 12,
          "outputGlyphs": 11,
          "requiredCodepoints": 2,
          "notInMaster": [
            "U+9F98 龘"
          ],
          "notInMasterCount": 1,
          "checks": {
            "cmap-coverage": {
              "ok": true,
              "present": 1,
              "wanted": 2
            }
          },
          "warnings": [
            "OEBPS/Fonts/full.ttf: 1 required characters are not in the master font (fallback fonts must cover them)"
          ]
        },
        {
          "target": "OEBPS/Fonts/math.otf",
          "action": "preserve",
          "reason": "math-table",
          "masterSHA256": "c66378031eb245588d81085c7445a48c882acec7845fa800f9765f1594de12bd",
          "originalSHA256": "c66378031eb245588d81085c7445a48c882acec7845fa800f9765f1594de12bd",
          "outputSHA256": "c66378031eb245588d81085c7445a48c882acec7845fa800f9765f1594de12bd",
          "masterBytes": 14,
          "originalBytes": 14,
          "outputBytes": 14,
          "masterGlyphs": 12,
          "outputGlyphs": 12,
          "requiredCodepoints": null,
          "notInMaster": null,
          "notInMasterCount": null,
          "checks": {
            "preserved-bytes": {
              "ok": true,
              "sha256": "c66378031eb245588d81085c7445a48c882acec7845fa800f9765f1594de12bd"
            }
          },
          "warnings": []
        }
      ],
      "warnings": []
    },
    "epub.package.nav.audit.actionableFindings": [
      {
        "kind": "missing-html-lang",
        "file": "OEBPS/nav.xhtml",
        "locator": {
          "selector": "html"
        },
        "params": {
          "value": "en"
        },
        "lane": "tag",
        "autoFixable": true,
        "confidence": "high",
        "evidence": "\u003chtml\u003e root element missing lang/xml:lang"
      },
      {
        "kind": "missing-html-lang",
        "file": "OEBPS/chapter.xhtml",
        "locator": {
          "selector": "html"
        },
        "params": {
          "value": "en"
        },
        "lane": "tag",
        "autoFixable": true,
        "confidence": "high",
        "evidence": "\u003chtml\u003e root element missing lang/xml:lang"
      }
    ],
    "epub.package.nav.audit.auditStatus": "warn",
    "epub.package.nav.audit.findings": [
      {
        "level": "warn",
        "id": "audit.0",
        "title": "Kindle/legacy delivery should keep toc.ncx and spine toc=\"ncx\""
      },
      {
        "level": "warn",
        "id": "audit.1",
        "title": "Cover should have properties=\"cover-image\" and legacy meta name=\"cover\""
      },
      {
        "level": "warn",
        "id": "audit.2",
        "title": "Actionable issue detected: missing-html-lang",
        "detail": "missing-html-lang",
        "location": "OEBPS/nav.xhtml"
      },
      {
        "level": "warn",
        "id": "audit.3",
        "title": "Actionable issue detected: missing-html-lang",
        "detail": "missing-html-lang",
        "location": "OEBPS/chapter.xhtml"
      }
    ],
    "epub.package.nav.audit.findingsByLevel": {
      "error": 0,
      "warn": 4,
      "info": 0
    },
    "epub.package.nav.audit.input_kind": "existing-epub",
    "epub.package.nav.audit.recommendedSkills": [
      "$epub-audit",
      "$epub-reader-verify",
      "$epub-special-layout"
    ],
    "epub.package.nav.audit.status": "complete",
    "epub.package.nav.audit.summary": {
      "language": "en",
      "manifest_items": 4,
      "media_counts": {
        "css": 0,
        "fonts": 2,
        "images": 0,
        "other": 0,
        "xhtml": 2
      },
      "opf": "OEBPS/package.opf",
      "package_version": "3.0",
      "spine_items": 1,
      "zip_entries": 7
    },
    "epub.package.nav.audit.toolAvailability": {
      "epubcheck": false
    }
  },
  "findings": [
    {
      "level": "info",
      "id": "upstream.diagnostics",
      "title": "epub.package.nav.audit reported 0 error / 4 warn findings (diagnostic, not blocking)",
      "detail": "see facts[\"epub.package.nav.audit.findings\"]",
      "location": "epub.package.nav.audit"
    },
    {
      "level": "warn",
      "id": "font-subset.not-in-master",
      "title": "Font master lacks required characters",
      "detail": "1 required characters are absent from the master font; fallback fonts must cover them; examples: U+9F98 龘",
      "location": "OEBPS/Fonts/full.ttf"
    }
  ],
  "events": [
    {
      "step": "drm-preflight",
      "status": "completed"
    },
    {
      "step": "epub.package.nav.audit",
      "status": "completed",
      "message": "diagnostic: 0 error, 4 warn"
    },
    {
      "step": "epub.font.subset",
      "status": "completed"
    },
    {
      "step": "redline",
      "status": "completed",
      "message": "0 findings"
    },
    {
      "step": "write-output",
      "status": "completed",
      "message": "\u003ccandidate.epub\u003e"
    }
  ]
}
