{
  "schemaVersion": "2",
  "capability": "epub.notes.legacy-fallback",
  "status": "planned",
  "input": {
    "path": "\u003cfixture.epub\u003e"
  },
  "facts": {
    "epub.notes.legacy-fallback.editCount": 3,
    "epub.notes.legacy-fallback.filesScanned": 2,
    "epub.notes.legacy-fallback.plannedEdits": [
      {
        "path": "OEBPS/Text/chapter.xhtml",
        "tag": "a",
        "id": "nr1",
        "addClass": "duokan-footnote"
      },
      {
        "path": "OEBPS/Text/chapter.xhtml",
        "tag": "ol",
        "addClass": "duokan-footnote-content"
      },
      {
        "path": "OEBPS/Text/chapter.xhtml",
        "tag": "li",
        "id": "n1",
        "addClass": "duokan-footnote-item"
      }
    ],
    "epub.notes.legacy-fallback.skipped": [
      {
        "path": "OEBPS/nav.xhtml",
        "target": "notes",
        "reason": "no-noteref"
      }
    ],
    "epub.notes.popup.normalize.findingsByLevel": {
      "error": 0,
      "warn": 1,
      "info": 0
    },
    "epub.notes.popup.normalize.status": "complete",
    "epub.package.nav.audit.findingsByLevel": {
      "error": 0,
      "warn": 0,
      "info": 1
    },
    "epub.package.nav.audit.status": "complete",
    "pipeline.dryRun": true,
    "pipeline.modifiedEntries": [
      "OEBPS/Text/chapter.xhtml"
    ]
  },
  "findings": [
    {
      "level": "info",
      "id": "upstream.diagnostics",
      "title": "epub.notes.popup.normalize reported 0 error / 1 warn findings (diagnostic, not blocking)",
      "detail": "see facts[\"epub.notes.popup.normalize.findingsByLevel\"]",
      "location": "epub.notes.popup.normalize"
    }
  ],
  "events": [
    {
      "step": "drm-preflight",
      "status": "completed"
    },
    {
      "step": "epub.package.nav.audit",
      "status": "completed",
      "message": "diagnostic: 0 error, 0 warn"
    },
    {
      "step": "epub.notes.popup.normalize",
      "status": "completed",
      "message": "diagnostic: 0 error, 1 warn"
    },
    {
      "step": "epub.notes.legacy-fallback",
      "status": "completed"
    },
    {
      "step": "redline",
      "status": "completed",
      "message": "0 findings"
    }
  ],
  "nextCommands": [
    "epub run epub.notes.legacy-fallback --input fixture.epub --output fixture.notes-legacy-fallback.epub --json"
  ]
}
