{
  "schemaVersion": "2",
  "capability": "epub.kindle.compatibility.check",
  "status": "complete",
  "input": {
    "path": "\u003cfixture.epub\u003e"
  },
  "facts": {
    "epub.kindle.compatibility.check.checks": [
      "kindle.ncx-missing",
      "kindle.cover-not-raster",
      "kindle.image-webp",
      "kindle.image-tiff",
      "kindle.image-gif",
      "kindle.image-svg",
      "kindle.css-transform-rotate",
      "kindle.css-styled-underline",
      "kindle.css-amzn-media-query",
      "kindle.css-img-direct-float",
      "kindle.css-unicode-range",
      "kindle.css-parse-failed"
    ],
    "epub.kindle.compatibility.check.counts": {
      "kindle.cover-not-raster": 0,
      "kindle.css-amzn-media-query": 0,
      "kindle.css-img-direct-float": 0,
      "kindle.css-parse-failed": 0,
      "kindle.css-styled-underline": 0,
      "kindle.css-transform-rotate": 0,
      "kindle.css-unicode-range": 0,
      "kindle.image-gif": 0,
      "kindle.image-svg": 0,
      "kindle.image-tiff": 0,
      "kindle.image-webp": 0,
      "kindle.ncx-missing": 0
    },
    "epub.kindle.compatibility.check.cssFilesScanned": 1,
    "epub.kindle.compatibility.check.staticOnly": true,
    "epub.kindle.compatibility.check.xhtmlFilesScanned": 2,
    "epub.package.nav.audit.findingsByLevel": {
      "error": 0,
      "warn": 0,
      "info": 1
    },
    "epub.package.nav.audit.status": "complete",
    "pipeline.dryRun": true,
    "pipeline.modifiedEntries": []
  },
  "findings": [],
  "events": [
    {
      "step": "epub.package.nav.audit",
      "status": "completed",
      "message": "diagnostic: 0 error, 0 warn"
    },
    {
      "step": "epub.kindle.compatibility.check",
      "status": "completed"
    }
  ]
}
